[
  {
    "id": "npc_beach_survivor",
    "name": "Gniewosz",
    "role": "Rozbitek / Uchodźca",
    "gender": "male",
    "faction": "neutral",
    "title": "Stary rozbitek",
    "stats": {
      "hp": 30,
      "max_hp": 30,
      "mana": 0,
      "max_mana": 0,
      "strength": 4,
      "dexterity": 3,
      "armor": 1,
      "magic_resist": 0,
      "level": 1,
      "xp": 0,
      "xp_to_next": 100,
      "skill_points": 0
    },
    "equipment": {
      "weapon": "sword_rusted_dagger"
    },
    "inventory": [
      "potion_healing_small",
      "misc_gold"
    ],
    "default_dialog": "dialog_beach_survivor_greeting",
    "dialogs": [
      "dialog_beach_survivor_greeting",
      "dialog_beach_survivor_quest"
    ],
    "crime_reaction": {
      "witness_threshold": 200,
      "alert_range": 300,
      "reaction": "warn",
      "reputation_change": -5
    },
    "quest_ids": [
      "quest_main_arrival"
    ],
    "spawn_position": {
      "x": 400,
      "y": 480,
      "location_id": "loc_beach"
    },
    "is_essential": true
  },
  {
    "id": "npc_old_komendant",
    "name": "Komendant Straży",
    "role": "Dowódca Grodu Straży",
    "gender": "male",
    "faction": "old_order",
    "title": "Komendant",
    "stats": {
      "hp": 200,
      "max_hp": 200,
      "mana": 0,
      "max_mana": 0,
      "strength": 24,
      "dexterity": 12,
      "armor": 16,
      "magic_resist": 5,
      "level": 12,
      "xp": 0,
      "xp_to_next": 500,
      "skill_points": 0
    },
    "equipment": {
      "weapon": "sword_executioner",
      "armor": "armor_iron_plate"
    },
    "inventory": [
      "potion_healing_large",
      "misc_gold"
    ],
    "default_dialog": "dialog_old_komendant_greeting",
    "dialogs": [
      "dialog_old_komendant_greeting",
      "dialog_old_komendant_quest",
      "dialog_old_komendant_join"
    ],
    "crime_reaction": {
      "witness_threshold": 300,
      "alert_range": 500,
      "reaction": "attack",
      "reputation_change": -20
    },
    "quest_ids": [
      "quest_old_01",
      "quest_old_02",
      "quest_old_03"
    ],
    "spawn_position": {
      "x": 300,
      "y": 300,
      "location_id": "loc_old_fort"
    },
    "is_essential": true
  },
  {
    "id": "npc_old_weaponmaster",
    "name": "Grot",
    "role": "Mistrz broni",
    "gender": "male",
    "faction": "old_order",
    "title": "Mistrz Grot",
    "stats": {
      "hp": 150,
      "max_hp": 150,
      "mana": 0,
      "max_mana": 0,
      "strength": 18,
      "dexterity": 14,
      "armor": 12,
      "magic_resist": 3,
      "level": 10,
      "xp": 0,
      "xp_to_next": 400,
      "skill_points": 0
    },
    "equipment": {
      "weapon": "sword_iron_longsword",
      "armor": "armor_guard_chainmail"
    },
    "inventory": [],
    "default_dialog": "dialog_old_weaponmaster_greeting",
    "dialogs": [
      "dialog_old_weaponmaster_greeting",
      "dialog_old_weaponmaster_train"
    ],
    "crime_reaction": {
      "witness_threshold": 250,
      "alert_range": 400,
      "reaction": "warn",
      "reputation_change": -10
    },
    "teaching": [
      {
        "skill_id": "combat_sword",
        "skill_name": "Trening Bojowy (Miecz)",
        "max_rank": 3,
        "cost_per_rank": {
          "gold": 100,
          "skill_points": 2
        },
        "requirements": {
          "min_level": 1
        },
        "description": "Nauka władania mieczem."
      },
      {
        "skill_id": "combat_bow",
        "skill_name": "Trening Bojowy (Łuk)",
        "max_rank": 2,
        "cost_per_rank": {
          "gold": 120,
          "skill_points": 2
        },
        "requirements": {
          "min_level": 2
        },
        "description": "Nauka strzelania z łuku."
      }
    ],
    "quest_ids": [
      "quest_old_01"
    ],
    "spawn_position": {
      "x": 250,
      "y": 350,
      "location_id": "loc_old_fort"
    },
    "is_essential": true,
    "is_trainer": true
  },
  {
    "id": "npc_old_guard_1",
    "name": "Strażnik Bartłomiej",
    "role": "Strażnik bramy",
    "gender": "male",
    "faction": "old_order",
    "title": "Strażnik",
    "stats": {
      "hp": 80,
      "max_hp": 80,
      "mana": 0,
      "max_mana": 0,
      "strength": 10,
      "dexterity": 6,
      "armor": 8,
      "magic_resist": 2,
      "level": 4,
      "xp": 0,
      "xp_to_next": 200,
      "skill_points": 0
    },
    "equipment": {
      "weapon": "sword_old_shortsword",
      "armor": "armor_guard_chainmail"
    },
    "inventory": [],
    "default_dialog": "dialog_guard_generic",
    "dialogs": [
      "dialog_guard_generic",
      "dialog_guard_quest_info"
    ],
    "crime_reaction": {
      "witness_threshold": 250,
      "alert_range": 400,
      "reaction": "attack",
      "reputation_change": -15
    },
    "quest_ids": [
      "quest_old_01"
    ],
    "spawn_position": {
      "x": 320,
      "y": 280,
      "location_id": "loc_old_fort"
    }
  },
  {
    "id": "npc_old_guard_2",
    "name": "Strażniczka Marta",
    "role": "Strażniczka patrolowa",
    "gender": "female",
    "faction": "old_order",
    "title": "Strażniczka",
    "stats": {
      "hp": 75,
      "max_hp": 75,
      "mana": 0,
      "max_mana": 0,
      "strength": 9,
      "dexterity": 8,
      "armor": 8,
      "magic_resist": 2,
      "level": 4,
      "xp": 0,
      "xp_to_next": 200,
      "skill_points": 0
    },
    "equipment": {
      "weapon": "sword_old_shortsword",
      "armor": "armor_guard_chainmail"
    },
    "inventory": [],
    "default_dialog": "dialog_guard_generic",
    "dialogs": [
      "dialog_guard_generic"
    ],
    "crime_reaction": {
      "witness_threshold": 250,
      "alert_range": 400,
      "reaction": "attack",
      "reputation_change": -15
    },
    "quest_ids": [],
    "spawn_position": {
      "x": 280,
      "y": 320,
      "location_id": "loc_old_fort"
    }
  },
  {
    "id": "npc_old_guard_3",
    "name": "Strażnik Zbigniew",
    "role": "Strażnik magazynu",
    "gender": "male",
    "faction": "old_order",
    "stats": {
      "hp": 80,
      "max_hp": 80,
      "mana": 0,
      "max_mana": 0,
      "strength": 11,
      "dexterity": 5,
      "armor": 8,
      "magic_resist": 2,
      "level": 4,
      "xp": 0,
      "xp_to_next": 200,
      "skill_points": 0
    },
    "equipment": {
      "weapon": "sword_old_shortsword",
      "armor": "armor_guard_chainmail"
    },
    "inventory": [],
    "default_dialog": "dialog_guard_generic",
    "dialogs": [
      "dialog_guard_generic"
    ],
    "crime_reaction": {
      "witness_threshold": 200,
      "alert_range": 350,
      "reaction": "attack",
      "reputation_change": -15
    },
    "quest_ids": [
      "quest_new_03"
    ],
    "spawn_position": {
      "x": 340,
      "y": 260,
      "location_id": "loc_old_fort"
    }
  },
  {
    "id": "npc_old_smith",
    "name": "Kowal Gerhard",
    "role": "Kowal",
    "gender": "male",
    "faction": "old_order",
    "title": "Kowal",
    "stats": {
      "hp": 60,
      "max_hp": 60,
      "mana": 0,
      "max_mana": 0,
      "strength": 14,
      "dexterity": 5,
      "armor": 4,
      "magic_resist": 1,
      "level": 3,
      "xp": 0,
      "xp_to_next": 150,
      "skill_points": 0
    },
    "equipment": {},
    "inventory": [
      "sword_iron_longsword",
      "sword_old_shortsword",
      "misc_gold"
    ],
    "default_dialog": "dialog_old_smith_greeting",
    "dialogs": [
      "dialog_old_smith_greeting",
      "dialog_old_smith_quest"
    ],
    "crime_reaction": {
      "witness_threshold": 150,
      "alert_range": 300,
      "reaction": "demand_return",
      "reputation_change": -5
    },
    "quest_ids": [
      "quest_side_01"
    ],
    "spawn_position": {
      "x": 220,
      "y": 380,
      "location_id": "loc_old_fort"
    },
    "is_merchant": true,
    "merchant_group": "blacksmith"
  },
  {
    "id": "npc_old_merchant",
    "name": "Kupiec Alojzy",
    "role": "Handlarz",
    "gender": "male",
    "faction": "old_order",
    "stats": {
      "hp": 40,
      "max_hp": 40,
      "mana": 0,
      "max_mana": 0,
      "strength": 3,
      "dexterity": 4,
      "armor": 1,
      "magic_resist": 0,
      "level": 2,
      "xp": 0,
      "xp_to_next": 100,
      "skill_points": 0
    },
    "equipment": {},
    "inventory": [
      "potion_healing_small",
      "potion_healing_medium",
      "misc_arrow",
      "misc_lockpick_iron"
    ],
    "default_dialog": "dialog_merchant_generic",
    "dialogs": [
      "dialog_merchant_generic"
    ],
    "crime_reaction": {
      "witness_threshold": 200,
      "alert_range": 300,
      "reaction": "call_guards",
      "reputation_change": -15
    },
    "quest_ids": [
      "quest_new_01"
    ],
    "spawn_position": {
      "x": 200,
      "y": 400,
      "location_id": "loc_old_fort"
    },
    "is_merchant": true,
    "merchant_group": "general"
  },
  {
    "id": "npc_old_innkeeper",
    "name": "Oberżysta Bertold",
    "role": "Karczmarz",
    "gender": "male",
    "faction": "old_order",
    "title": "Gospodarz",
    "stats": {
      "hp": 35,
      "max_hp": 35,
      "mana": 0,
      "max_mana": 0,
      "strength": 3,
      "dexterity": 3,
      "armor": 1,
      "magic_resist": 0,
      "level": 2,
      "xp": 0,
      "xp_to_next": 100,
      "skill_points": 0
    },
    "equipment": {},
    "inventory": [
      "potion_healing_small",
      "potion_stamina"
    ],
    "default_dialog": "dialog_innkeeper_generic",
    "dialogs": [
      "dialog_innkeeper_generic",
      "dialog_innkeeper_rumors"
    ],
    "crime_reaction": {
      "witness_threshold": 150,
      "alert_range": 250,
      "reaction": "warn",
      "reputation_change": -5
    },
    "quest_ids": [
      "quest_side_03"
    ],
    "spawn_position": {
      "x": 350,
      "y": 350,
      "location_id": "loc_old_fort"
    },
    "is_merchant": true,
    "merchant_group": "inn"
  },
  {
    "id": "npc_old_messenger",